<?xml version="1.0" encoding="UTF-8" standalone="no"?>
<PATH name="Journeyman" lang="en" rulesetversion="ED4" xmlns="http://earthdawn.com/path" xmlns:xsi="http://www.w3.org/2001/XMLSchema-instance" xmlns:edt="http://earthdawn.com/datatypes" xsi:schemaLocation="http://earthdawn.com/path ../../earthdawnpath.xsd">
	<NEEDEDKNACK>Journeyman</NEEDEDKNACK>
	<TALENT name="Journeyman" tier="master"/><!-- learned talent with knack on Rank1. The max rank is 5. -->
	<TIER name="journeyman">
		<PATHFOREIGNTALENTS maxcircle="4"/>
		<RANK><!-- 1 -->
			<TALENTABILITY/>
		</RANK>
		<RANK><!-- 2 -->
			<TALENTABILITY/>
		</RANK>
	</TIER>
	<TIER>
		<PATHFOREIGNTALENTS maxcircle="8"/>
		<RANK><!-- 3 -->
			<TALENTABILITY/>
		</RANK>
		<RANK><!-- 4 -->
			<TALENTABILITY/>
		</RANK>
	</TIER>
	<TIER>
		<OPTIONALTALENT name="Morphism"/>
		<PATHFOREIGNTALENTS maxcircle="12"/>
		<RANK><!-- 5 -->
			<TALENTABILITY/>
		</RANK>
	</TIER>
	<KARMARITUAL>Journeyman Karma Rituals expand the adeptâ€™s perspective beyond their Discipline and often show adaptability to their surroundings. The Karma Ritual of some Journeymen is never the same twice, each day reflecting a new perspective and a slight variation.</KARMARITUAL>
	<HALFMAGIC>No additional half magic for Journeyman.</HALFMAGIC>
</PATH>
